,Date,time,handle,tweet,compound,American,Delta,Southwest,United,tweets_clean1,hashtags,cluster_num
3273,2017-10-31,00:25:04,top_pix,@united It was the first class cabin bathroom door also to make matters worse there was no meal to be offered the flight attendant said they had problems with the caterer. Here's a picture of sticky stuff on the wall in front of me and pretzels on my seat when I boarded it was terrible,-0.875,0.0,0.0,0.0,1.0,first class cabin bathroom door also make matters worse meal offered flight attendant said problems caterer here is picture sticky stuff wall front pretzels seat boarded terrible,,2
3274,2017-10-31,00:24:21,ChuckCaruso,"@hemantmehta @united When they put out the ""we're sorry"" basket, you gotta RUN at that fucker.",-0.6808,0.0,0.0,0.0,1.0,put sorry basket gotta run fucker,,1
3276,2017-10-31,00:24:02,dustyhoffman,"@united I’ve tried to talk to you guys and nobody wants to make it right.  I tried face2face, I’ve tried by phone, bumped, late, now a broken plane",-0.4767,0.0,0.0,0.0,1.0,i have tried talk guys nobody wants make right tried face2face i have tried phone bumped late broken plane,,4
3281,2017-10-31,00:20:57,Merozay23,@united is literally the worst airline ever. I just got yelled by a flight attendant b/c I asked someone to move from the seat I paid for.,-0.6249,0.0,0.0,0.0,1.0,literally worst airline ever got yelled flight attendant bc asked someone move seat paid,,4
3284,2017-10-31,00:19:07,D_miles30,@united why do you always make my Tummy hurt #frequentflyer #mileageplusmember # #flyersmatter #SanFrancisco  #MondayMotivation,-0.5267,0.0,0.0,0.0,1.0,always make tummy hurt #frequentflyer #mileageplusmember #flyersmatter #sanfrancisco #mondaymotivation,"['#frequentflyer', '#mileageplusmember', '#flyersmatter', '#sanfrancisco', '#mondaymotivation']",1
3305,2017-10-30,23:53:13,imadeitcool,@united FUCK YALL. NEVER AGAIN.,-0.6408,0.0,0.0,0.0,1.0,fuck you all never,,4
3307,2017-10-30,23:51:24,_mio,"*nothing* is more painful than flying with @united - worst airline, worst service, pettiest staff🤦‍️🤦‍️🤦‍️",-0.9286,0.0,0.0,0.0,1.0,nothing painful flying worst airline worst service pettiest staff🤦️🤦️🤦️,,4
3311,2017-10-30,23:47:32,ChistormWoW,"@united Flight 460 to SFO been delayed an hour, employees leaving everyone in dark. Late attendants because napping. Prettt horrible CS imo",-0.6597,0.0,0.0,0.0,1.0,flight sfo delayed hour employees leaving everyone dark late attendants napping prettt horrible cs imo,,0
3318,2017-10-30,23:43:17,dustyhoffman,"@united Really, really unhappy with your service and your customer service. Zero customer service. In person and by phone. Missed flights!!",-0.7315,0.0,0.0,0.0,1.0,really really unhappy service customer service zero customer service person phone missed flights,,3
3319,2017-10-30,23:42:43,autumnmonroe,Sorry @delta cheated @United and they SUCK even @Starbucks was wack. #illbefaithful #wonthappenagain #deltahasbestcustomerservice,-0.8038,0.0,1.0,0.0,1.0,sorry cheated suck even wack #illbefaithful #wonthappenagaineahasbestcustomerservice,"['#illbefaithful', '#wonthappenagaineahasbestcustomerservice']",4
3325,2017-10-30,23:32:57,mags2198,"@united Flight cancelled due to mech prob, no flights til tomorrow so extra expenses for me but no compensation or even an upgrade?!",-0.636,0.0,0.0,0.0,1.0,flight cancelled due mech prob flights til tomorrow extra expenses compensation even upgrade,,2
3329,2017-10-30,23:26:47,lampshade_music,Remind me to never travel by plane again... it’s always a trap for an awful experience. Way to go @Delta and @united for making me never want to travel again.,-0.6728,0.0,1.0,0.0,1.0,remind never travel plane always trap awful experience way go making never want travel,,4
3334,2017-10-30,23:16:04,thenuka,@CalgaryLankan @united Oh no! That’s a long flight to be stuck in with bad food. I’ve found food in @emirates @flysrilankan and @qatarairways is awesome!,-0.4912,0.0,0.0,0.0,1.0,oh thats long flight stuck bad food i have found food awesome,,4
3335,2017-10-30,23:14:14,Hector_OG,@united in LAX fucking sucks,-0.4201,0.0,0.0,0.0,1.0,lax fucking sucks,,1
3362,2017-10-30,22:47:52,BTayO,@united turning into @SpiritAirlines with crazy charges and crappy service,-0.7964,0.0,0.0,0.0,1.0,turning crazy charges crappy service,,3
3368,2017-10-30,22:42:20,donniethebird,"@united It shouldn’t be a customer to customer basis! Just get it right for everyone...from boarding to in-flight to landing. Rude, unorganized, etc",-0.5093,0.0,0.0,0.0,1.0,shouldnt customer customer basis get right everyonefrom boarding inflight landing rude unorganized etc,,3
3369,2017-10-30,22:42:13,janetdiato,@united 40 mins late &amp; counting...on the second leg of the trip. The original trip was delayed as well. Plus no movies/wifi. Horrible experience!!!,-0.6219,0.0,0.0,0.0,1.0,minutes late and countingon second leg trip original trip delayed well plus movieswifi horrible experience,,0
3378,2017-10-30,22:22:05,janetdiato,@united is the worst!! I just want to get home. Delays at every stage of the trip is not cool ️,-0.7466,0.0,0.0,0.0,1.0,worst want get home delays every stage trip cool,,4
3399,2017-10-30,21:58:00,SQLFlipFlopsDBA,"@united I can understand if a wheel is damaged or a handle is ripped, but the handle can’t even pull out to lock in place due to how bad the bend is",-0.7717,0.0,0.0,0.0,1.0,understand wheel damaged handle ripped handle can not even pull lock place due bad bend,,4
3405,2017-10-30,21:52:38,febaio,"@united what happened w UA561 this morning at 7:45?Cancelled w/o notification. No reimbursement,no apologies, no food. RE-booked for 6:30pm?",-0.5803,0.0,0.0,0.0,1.0,happened ua561 morning wo notification reimbursementno apologies food rebooked,,2
3415,2017-10-30,21:41:30,D_southerngent,@united Bad enough I was about to pay $701 for a 1hr and 45 minute flight,-0.5994,0.0,0.0,0.0,1.0,bad enough pay minute flight,,4
3422,2017-10-30,21:30:48,ronrouz,Last time I ever fly @united. Your attendant just told me it was known it'd be delayed 2 HOURS ago and no update until I'm at the gate,-0.4767,0.0,0.0,0.0,1.0,last time ever fly attendant told known itd delayed hours ago update i am gate,,0
3425,2017-10-30,21:28:37,D_southerngent,"@united will never fly you again. If I cant be guaranteed a price after I choose my flight, then thats worthless.",-0.4404,0.0,0.0,0.0,1.0,never fly can not guaranteed price choose flight thats worthless,,1
3428,2017-10-30,21:26:17,D_southerngent,"@united you lost a customer that flies 3 times a month, mostly international. Was quoted a price, error when i went to purchase, $150 more!",-0.6476,0.0,0.0,0.0,1.0,lost customer flies times month mostly international quoted price error went purchase,,3
3432,2017-10-30,21:22:22,letsgoskatepool,@united Thankfully it was just a scare due to a short lived problem on the runaway at IAH (and Wi-Fi was only out 5 min),-0.4767,0.0,0.0,0.0,1.0,thankfully scare due short lived problem runaway iah wifi min,,2
3446,2017-10-30,21:11:14,CalgaryLankan,"I flew @united inaugural UA38 SIN LAX. Ceremony, aircraft &amp; inflight ent. system is great! BUT food, cabin service WIFI is VERY POOR #PaxEx",-0.848,0.0,0.0,0.0,1.0,flew inaugural ua38 sin lax ceremony aircraft and inflight ent system great food cabin service wifi poor #paxex,['#paxex'],3
3448,2017-10-30,21:10:34,kesilk,Currently boycotting @united because they are a poor airline and I WILL NOT PAY MORE FOR A CARRY-ON,-0.7865,0.0,0.0,0.0,1.0,currently boycotting poor airline pay carry on,,2
3456,2017-10-30,21:04:00,happyasskira,fuck @united airlines they suck ass,-0.872,0.0,0.0,0.0,1.0,fuck airlines suck ass,,4
3459,2017-10-30,21:01:21,_Tropp,You guys are really in a crisis at San Fran airport  @united Almost a 3 hour delay. I could have driven if I wanted to wait this long,-0.7506,0.0,0.0,0.0,1.0,guys really crisis san fran airport almost hour delay could driven wanted wait long,,0
3460,2017-10-30,20:58:04,maybemarissa,"@United If you’re going to keep delaying flight 1820, can your attendants at least announce it &amp; explain? A nearly 3 hr delay is ridiculous.",-0.5859,0.0,0.0,0.0,1.0,you are going keep delaying flight attendants least announce and explain nearly hr delay ridiculous,,0
3464,2017-10-30,20:52:29,_Tropp,YOU’RE KILLING ME SMALLS! GET IT TOGETHER @united,-0.7525,0.0,0.0,0.0,1.0,you are killing smalls get together,,2
3465,2017-10-30,20:51:50,EuroDelays,@underwatergeek @PlaneSpotIsCool @united I have a block for such conceptions in my brain,-0.4404,0.0,0.0,0.0,1.0,block conceptions brain,,4
3470,2017-10-30,20:47:25,DocOnDev,"@Delta - This @United 1k isn't happy. ""Customer Service"" just rebooked me in economy on flight where I was already paid/booked 1st class.",-0.4585,0.0,1.0,0.0,1.0,is not happy customer service rebooked economy flight already paidbooked class,,3
3473,2017-10-30,20:43:05,CalgaryLankan,@united The inaugural UA38 SIN - LAX flew closer to 10K miles,-0.6523,0.0,0.0,0.0,1.0,inaugural ua38 sin lax flew closer miles,,1
3479,2017-10-30,20:37:15,MichaelTraverso,@united ailines WORST customer service agents in #history of business. #neveragain will I fly your airline,-0.7034,0.0,0.0,0.0,1.0,ailines worst customer service agents #history business #neveragain fly airline,"['#history', '#neveragain']",3
3488,2017-10-30,20:21:07,ClaireKathArm,@united when are you going to stop ripping people off? Seriously!,-0.4926,0.0,0.0,0.0,1.0,going stop ripping people seriously,,1
3493,2017-10-30,20:13:31,jfg2003,"Another day, another degradation of @United cust service. Weds will see more mileage devaluations. Add that to new narrower seats. #fail",-0.5267,0.0,0.0,0.0,1.0,another day another degradation customer service weds see mileage devaluations add new narrower seats #fail,['#fail'],3
3499,2017-10-30,20:05:15,georgevhulme,".@United Airlines uses @Tibco to reduce flight delay pain, writes @mitchwagner on @ECloudNews",-0.6808,0.0,0.0,0.0,1.0,united airlines uses reduce flight delay pain writes,,0
3509,2017-10-30,19:50:42,walke323,@United &amp; @Hertz are absolute worst!! Submitted status match promo on 10/13. 17 days &amp; 6 phone calls later: still no match and no clue! ,-0.8547,0.0,0.0,0.0,1.0,and absolute worst submitted status match promo days and phone calls later still match clue,,4
3526,2017-10-30,19:32:30,donniethebird,Flying @united today and already regretting it...now I remember why I’m always a @SouthwestAir guy,-0.4019,0.0,0.0,1.0,1.0,flying today already regretting itnow remember i am always guy,,4
3529,2017-10-30,19:22:09,StarpowerHenry,"@united Please ditch the Spanish Paella in domestic First. Simply put, it is not good! Feel free to bring back the chicken curry!",-0.5255,0.0,0.0,0.0,1.0,please ditch spanish paella domestic first simply put good feel free bring back chicken curry,,4
3530,2017-10-30,19:20:48,JMC145,@Jason92Adams @united @LindsAdams07 This is getting worse and worse. She’s so confused and lost. Doesn’t know who’s responsible for her: @British_Airways Or @Lufthansa_USA,-0.8425,0.0,0.0,0.0,1.0,getting worse worse she is confused lost does not know who is responsible,,2
3531,2017-10-30,19:20:46,KLJDavis,@sallykohn @united Its called  You never have to be booked in a crappy seat again.,-0.5574,0.0,0.0,0.0,1.0,called never booked crappy seat,,2
3545,2017-10-30,19:07:38,wannabpainter,"@united I understand weather delays, but the gate agents are screaming and being downright rude to passengers. Flying out of LGA",-0.8126,0.0,0.0,0.0,1.0,understand weather delays gate agents screaming downright rude passengers flying lga,,2
3547,2017-10-30,19:05:16,Jason92Adams,@JMC145 @united @LindsAdams07 That’s so terrible! Poor Mom...trip of a lifetime,-0.8254,0.0,0.0,0.0,1.0,thats terrible poor momtrip lifetime,,1
3549,2017-10-30,19:03:34,JMC145,@Jason92Adams @united @LindsAdams07 Currently no. Tour group says they’ll have to try to meet up with her in Malta instead of Athens. Buts it’s really difficult to get there,-0.6115,0.0,0.0,0.0,1.0,currently tour group says they will try meet maa instead athens buts really difficu get,,2
3550,2017-10-30,19:01:43,idrawgoodart,"#inktober day 29: #UNITED. On April 9, Dr. David Dao was “re-accommodated” off of @united flight 3411. He suffered a concussion, broken nose, and missing teeth.",-0.8176,0.0,0.0,0.0,1.0,#inktober day #united april dr david dao reaccommodated flight suffered concussion broken nose missing teeth,"['#inktober', '#united']",0
3552,2017-10-30,19:01:24,DCxViper,@BrizzyVoices @united This is why i hate flying,-0.5719,0.0,0.0,0.0,1.0,hate flying,,4
3556,2017-10-30,18:59:05,chrisveigt,"@united hey, trying to check in my flight and getting an Internal server error every time I try!",-0.4574,0.0,0.0,0.0,1.0,hey trying check flight getting internal server error every time try,,1
3559,2017-10-30,18:53:49,katiehoffman7,@united @united your customer service is on FIRE today!! This is so absurd!!,-0.6487,0.0,0.0,0.0,1.0,customer service fire today absurd,,3
3567,2017-10-30,18:48:33,wannabpainter,"Including spirit, @united is by far the ABSOLUTE worst airlines I've ever flown. No wonder there are so many scandals #neveragain #gfy",-0.8434,0.0,0.0,0.0,1.0,including spirit far absolute worst airlines i have ever flown wonder many scandals #neveragain #gfy,"['#neveragain', '#gfy']",4
3571,2017-10-30,18:47:03,ctutt3,"@united, hard to believe no luggage yet for @emeliabird in Berlin 48hrs with no luggage! #customerservicesucks",-0.6239,0.0,0.0,0.0,1.0,hard believe luggage yet berlin luggage #customerservicesucks,['#customerservicesucks'],2
3583,2017-10-30,18:39:49,letsgoskatepool,Two scary messages on this flight. @UnitedFlyerHD @AirlineFlyer  #Travel Chill @united it's not Halloween yet!,-0.5411,0.0,0.0,0.0,1.0,two scary messages flight #travel chill halloween yet,['#travel'],2
3586,2017-10-30,18:38:05,gintas852123,@BrizzyVoices @united OMG thet suck you are hungry,-0.4404,0.0,0.0,0.0,1.0,omg thet suck hungry,,4
3597,2017-10-30,18:26:41,ed_guidry,"@united Yes I did. They located it in Houston and I get updates texted, but they all say they are still trying to locate it. Very upset right now.",-0.4569,0.0,0.0,0.0,1.0,yes located houston get updates texted say still trying locate upset right,,2
3604,2017-10-30,18:18:11,DarthNerdius,@united get it together. Delay after delay. Im about to miss my connecting flight bc of yet another delay.,-0.7579,0.0,0.0,0.0,1.0,get together delay delay i am miss connecting flight bc yet another delay,,0
3606,2017-10-30,18:17:20,katiehoffman7,"@united @united I understand things happen, but my main issue all day has been the lack of customer service. It's absolutely unacceptable.",-0.8121,0.0,0.0,0.0,1.0,understand things happen main issue day lack customer service absolutely unacceptable,,3
3607,2017-10-30,18:15:22,SQLFlipFlopsDBA,@united “We don’t cover damage to wheels or handles” even though the bar is protruding up through my suitcase rendering it unusable.,-0.4939,0.0,0.0,0.0,1.0,do not cover damage wheels handles even though bar protruding suitcase rendering unusable,,2
3612,2017-10-30,18:06:46,JMC145,"After 7 hours at airport yesterday, and 9 so far today, My Mother is about to be screwed by @united on a lifetime trip to Greece. ",-0.4939,0.0,0.0,0.0,1.0,hours airport yesterday far today mother screwed lifetime trip greece,,0
3614,2017-10-30,18:03:24,bpalacios04,"@vernglenn @united And the raiders lost!!! Sorry Vern, rough weekend still hasn’t ended for you",-0.5386,0.0,0.0,0.0,1.0,raiders lost sorry vern rough weekend still has not ended,,1
3615,2017-10-30,18:02:31,dodgerzfan1220,@RedwoodSoul @united @SingaporeAir Wrong. Those were discontinued in 2013.,-0.4767,0.0,0.0,0.0,1.0,wrong discontinued,,2
3616,2017-10-30,18:02:28,kbh04,@katiehoffman7 @united They are the absolute worst airline.,-0.6249,0.0,0.0,0.0,1.0,absolute worst airline,,4
3617,2017-10-30,18:02:25,SQLFlipFlopsDBA,Gotta buy a new suitcase since @united bent the bars for ext. handle so bad I can’t raise or lower it. Ugh.,-0.8588,0.0,0.0,0.0,1.0,gotta buy new suitcase since bent bars ext handle bad can not raise lower ugh,,4
3618,2017-10-30,18:02:00,THEvirginialu,"@United has failed me in every possible way. COMPLETE FAIL on Premier call-in line, Premier check-in line, gate agent, flight experience.",-0.8192,0.0,0.0,0.0,1.0,failed every possible way complete fail premier callin line premier checkin line gate agent flight experience,,2
3634,2017-10-30,17:46:54,CrimsonDagger,@BrizzyVoices par for the course for @united. Their new slogan should be frustrating but not surprising.,-0.489,0.0,0.0,0.0,1.0,par course new slogan frustrating surprising,,2
3646,2017-10-30,17:37:59,guzmanjmonica,@BrizzyVoices @united Oh god. That really sucks /:,-0.5059,0.0,0.0,0.0,1.0,oh god really sucks,,1
3649,2017-10-30,17:37:26,StoicViking2,@united Why doesn’t VIEW PAST RESV ever work? Always get UNABLE TO PROCESS msg. Need receipt for Exp Rpt. Very annoying. Fix this,-0.4576,0.0,0.0,0.0,1.0,does not view past resv ever work always get unable process msg need receipt exp rpt annoying fix,,2
3650,2017-10-30,17:37:00,Izzy125Izzy,@BrizzyVoices @united Ugh  that sounds lousy,-0.743,0.0,0.0,0.0,1.0,ugh sounds lousy,,0
3654,2017-10-30,17:34:48,tiannahmakia,@BrizzyVoices @united ugh that sucks I'm sorry,-0.6808,0.0,0.0,0.0,1.0,ugh sucks i am sorry,,1
3657,2017-10-30,17:33:06,Darcie_265,@BrizzyVoices @united Wowwww that’s right bad,-0.5423,0.0,0.0,0.0,1.0,wowwww thats right bad,,4
3664,2017-10-30,17:28:00,noravenatti,"@united 561 out of LGA this morning. Your land personal is what saves you, but the overall handling was and is terrible",-0.631,0.0,0.0,0.0,1.0,lga morning land personal saves overall handling terrible,,2
3669,2017-10-30,17:24:53,Zoe_J__,"@united It's a friend's res... A supervisor here at your hub explained, rather dismissively, that 'no fees are waived' - to get on a half empty ",-0.4588,0.0,0.0,0.0,1.0,friends res supervisor hub explained rather dismissively fees waived get half empty,,2
3672,2017-10-30,17:22:45,vernglenn,Dang @United...Now it's rolling delays! AND we were boarding at the time!!!!! We're all in line in the tunnel by the plane. Ugh,-0.6083,0.0,0.0,0.0,1.0,dang rolling delays boarding time line tunnel plane ugh,,1
3682,2017-10-30,17:13:06,samii_danielle,@united @Broncos And there’s no customer rep at the gate @united seriously awful service,-0.7096,0.0,0.0,0.0,1.0,there is customer representative gate seriously awful service,,3
3686,2017-10-30,17:09:21,HarrisRichie,@sallykohn @united Hell on Earth awaits some poor poor soul.,-0.8885,0.0,0.0,0.0,1.0,hell earth awaits poor poor soul,,1
3690,2017-10-30,17:06:32,makeupwithlisai,"Not funny, @united especially after my hell of a day yesterday.",-0.4522,0.0,0.0,0.0,1.0,funny especially hell day yesterday,,2
3697,2017-10-30,16:59:43,chazmaster44,@united whoever is in charge of your business doesn’t give a shit about the people who pay you money,-0.6124,0.0,0.0,0.0,1.0,whoever charge business does not give shit people pay money,,1
3699,2017-10-30,16:57:05,noravenatti,"Worst customer service ever @united ;8hrs delay on a 4hrs flight, no updates and close to zero support!",-0.7345,0.0,0.0,0.0,1.0,worst customer service ever delay flight updates close zero support,,3
3707,2017-10-30,16:48:57,jasenpage,@kylemccluer @united Hahaha.. had the same problem this weekend..safe travels brother!!,-0.508,0.0,0.0,0.0,1.0,hahaha problem weekendsafe travels brother,,2
3710,2017-10-30,16:47:44,B_Amer,I am smaller than the average American man &amp; I am stuffed in this @united seat. Sad what flying has become.,-0.4767,0.0,0.0,0.0,1.0,smaller average american man and stuffed seat sad flying become,,4
3711,2017-10-30,16:47:34,Oh_Fender,Will miss my bus out of Mex City bc @united demanded I gate check. Literally four empty overhead bins and four 1/2 empty when I boarded.,-0.6249,0.0,0.0,0.0,1.0,miss bus mex city bc demanded gate check literally four empty overhead bins four empty boarded,,2
3715,2017-10-30,16:43:18,machaves,"UA1548 SFO-LAX, less than an hour. From the time we landed, 47 min to get out of the plane. @united, what's wrong with this picture??",-0.5362,0.0,0.0,0.0,1.0,ua1548 sfolax less hour time landed min get plane what is wrong picture,,0
3719,2017-10-30,16:37:07,steveyuhas,Can you imagine anything worse than being on @United (the airline that beat Dr. Dao bloody) for 15 - 18 hours? Oy,-0.4767,0.0,0.0,0.0,1.0,imagine anything worse airline beat dr dao bloody hours oy,,4
3721,2017-10-30,16:35:47,jokonkwo,"I'm a consistent customer and a Mileage Plus member, but had an horrible experience due to issues on your end. Still got no response @united",-0.8201,0.0,0.0,0.0,1.0,i am consistent customer mileage plus member horrible experience due issues end still got response,,2
3732,2017-10-30,16:28:22,robertfrankmarc,@sallykohn @united Don’t sit beside Kohn. Her ass takes up two seats.,-0.5423,0.0,0.0,0.0,1.0,do not sit beside kohn ass takes two seats,,2
3738,2017-10-30,16:25:03,nextdaycorn,@sallykohn @united I saw you on @CNN yesterday and started following you immediately. You freaking rock!,-0.4753,0.0,0.0,0.0,1.0,saw yesterday started following immediately freaking rock,,4
3743,2017-10-30,16:22:26,TheRealMcNutt,@united is an absolute dumpster fire of an airline. Never again,-0.4588,0.0,0.0,0.0,1.0,absolute dumpster fire airline never,,4
3749,2017-10-30,16:17:29,chippersen,So irritated with @United right now. Cancelled my flight (not even weather related) and they won’t give me a hotel voucher.,-0.6478,0.0,0.0,0.0,1.0,irritated right cancelled flight even weather related will not give hotel voucher,,2
3753,2017-10-30,16:12:50,vernglenn,It just keeps getting more comical. Now THIS @United flt is delayed an hour!! Dulles to SFO. SMH.,-0.6723,0.0,0.0,0.0,1.0,keeps getting comical f delayed hour dulles sfo shaking my head,,0
3760,2017-10-30,16:08:30,Enrique_C18,@SouthwestAir You have really disappointed me. 2 hour delay because you did not check an aircraft is unforgivable. Next time I'll fly @united,-0.6901,0.0,0.0,1.0,1.0,really disappointed hour delay check aircraft unforgivable next time i will fly,,0
3772,2017-10-30,15:50:40,DerekBolman,"s/o @united for destroying my rack case after i was forced to ""check"" it at the gate ",-0.765,0.0,0.0,0.0,1.0,destroying rack case forced check gate,,2
3773,2017-10-30,15:49:53,woodwardjd,"@ronbronson looks like @united?  Yeah, that was a terrible experience.  It's a pain to copy 1 answer to 1password, let alone 5 :(",-0.765,0.0,0.0,0.0,1.0,looks like yeah terrible experience pain copy answer let alone,,2
3775,2017-10-30,15:46:58,skiskii11,@United you guys really suck.   Go back to beating your unruly passengers your planes at least took off on time then,-0.7346,0.0,0.0,0.0,1.0,guys really suck go back beating unruly passengers planes least took time,,1
3787,2017-10-30,15:31:30,matney_ryan,@united come get this nasty old lady sitting next to me touching me with her shoeless feet.,-0.6428,0.0,0.0,0.0,1.0,come get nasty old lady sitting next touching shoeless feet,,0
3799,2017-10-30,15:13:25,takehironagaoka,@united Finally! That old aircraft was a disaster. No more 12 hours of almost no in-flight entertainment in coach.,-0.7152,0.0,0.0,0.0,1.0,finally old aircraft disaster hours almost inflight entertainment coach,,0
3804,2017-10-30,15:07:43,chillEmpress,@united and everyone on your staff I went to for help did NOTHING FOR ME. One woman blamed me for not communicating clearly. How’s this for clear FUCK YOU,-0.6475,0.0,0.0,0.0,1.0,everyone staff went help nothing one woman blamed communicating clearly how is clear fuck,,4
3805,2017-10-30,15:07:34,TruffleMedia,- @united got on time gate departure pushed away from gate. pilot stops plane  says @Dulles_Airport winds restricting landings.parked 30min,-0.4939,0.0,0.0,0.0,1.0,got time gate departure pushed away gate pilot stops plane says winds restricting landingsparked,,2
3807,2017-10-30,15:06:16,chillEmpress,Screw u @united for changing my itinerary in the middle of the night and stranding me far from home. Zero customer service and I’m screwed.,-0.5574,0.0,0.0,0.0,1.0,screw changing itinerary middle night stranding far home zero customer service i am screwed,,3
3813,2017-10-30,15:01:10,DMVMCFLYY,@Dennie302 @united  that unacceptable always catch they attention,-0.4588,0.0,0.0,0.0,1.0,unacceptable always catch attention,,0
3815,2017-10-30,14:59:04,Dennie302,Dear @united I am a WHITE WOMAN in America. And your customer service is absolutely HORRENDOUS. totally unacceptable.,-0.7771,0.0,0.0,0.0,1.0,dear white woman america customer service absolutely horrendous totally unacceptable,,3
3825,2017-10-30,14:52:03,nelsonbarr01,@united there needs to be some sort of compensation for this. This is complete unacceptable and outrageous. My ENTIRE travel plan is ruined.,-0.8442,0.0,0.0,0.0,1.0,needs sort compensation complete unacceptable outrageous entire travel plan ruined,,2
3826,2017-10-30,14:51:25,ShaniSTAR23,"@united and now messed up my important obligations for the evening because instead of landing at 6:11p in NY, I land 11:18p!!!!!!",-0.4153,0.0,0.0,0.0,1.0,messed important obligations evening instead landing ny land,,2
3827,2017-10-30,14:51:04,RonKadish,.@united this was 30 minutes before flight. Why was your counter already closed? Occur to U that ppl might have tight connections? WTF?,-0.7247,0.0,0.0,0.0,1.0,united minutes flight counter already closed occur ppl might tight connections wtf,,0
3828,2017-10-30,14:50:41,ShaniSTAR23,@united You guys are officially on my bad list. Delayed my flight by 4 hrs. Got notified after I was at my gate. Now im missing my connect..,-0.765,0.0,0.0,0.0,1.0,guys officially bad list delayed flight hours got notified gate i am missing connect,,0
