,Date,time,handle,tweet,compound,American,Delta,Southwest,United,tweets_clean1,hashtags,cluster_num
6499,2017-10-27,19:24:30,Toddgman1,@united Ignore the negative comments.   Happy weekend!,-0.4199,0.0,0.0,0.0,1.0,ignore negative comments happy weekend,,1
6516,2017-10-27,19:13:35,PDelahanty,Even flying @united is less torture than this. I hate flying Southworst.,-0.8078,0.0,0.0,0.0,1.0,even flying less torture hate flying southworst,,4
6517,2017-10-27,19:09:58,loire1969,"@Reagan_Airport @SouthwestAir @AmericanAir @united @FAANews you are flying so low over us, it’s like we live in a war zone. What the hell!",-0.876,1.0,0.0,1.0,1.0,flying low us like live war zone hell,,1
6520,2017-10-27,19:09:06,loire1969,@united why are you flying so low and loud over Alexandria? It is unconscionable given your terrible customer service that you would do this,-0.7042,0.0,0.0,0.0,1.0,flying low loud alexandria unconscionable given terrible customer service would,,3
6531,2017-10-27,18:55:44,Drewmorgue,Props to @United for consistently having the worst customer service. #companystandard,-0.6249,0.0,0.0,0.0,1.0,props consistently worst customer service #companystandard,['#companystandard'],3
6535,2017-10-27,18:48:18,LaurenCott,"@united, you have terrible service. I'm very disappointed. By law, you're aloud one personal item and one carry on. Please explain.",-0.6361,0.0,0.0,0.0,1.0,terrible service i am disappointed law you are aloud one personal item one carry please explain,,3
6536,2017-10-27,18:47:49,hooscharlie,"Hey @united, I don't mind paying exorbitant fee for in flight wifi - if it works Frustrating paying so much for essentially useless service",-0.6908,0.0,0.0,0.0,1.0,hey do not mind paying exorbitant fee flight wifi works frustrating paying much essentially useless service,,3
6539,2017-10-27,18:46:04,CrazyyIn,@united Based on the pics my luggage is completely damaged.,-0.4927,0.0,0.0,0.0,1.0,based pics luggage completely damaged,,2
6540,2017-10-27,18:45:58,CrazyyIn,@united That is the reason why I am upset and posed this in Twitter because I believe it is the wrong determination.,-0.4588,0.0,0.0,0.0,1.0,reason upset posed twitter believe wrong determination,,2
6552,2017-10-27,18:34:22,JordanPavlic,UA flight 3565. His name is Rob. Twitter plz do ya thang. @united,-0.5106,0.0,0.0,0.0,1.0,ua flight name rob twitter plz ya thang,,4
6557,2017-10-27,18:26:57,leftcoastbabe,"@united  Boarded 501 at SFO hr ago. Door closed 10 min early. pilot ""we have worst gate 90 for traffic."" Must wait indefinitely. It's BS",-0.6249,0.0,0.0,0.0,1.0,boarded sfo hr ago door closed min early pilot worst gate traffic must wait indefinitely bs,,4
6558,2017-10-27,18:25:53,BeckySalman,You know what else should be illegal? BASIC ECONOMY. What is this shit? I feel like I got tricked into this. Stop tryna rip us off @united,-0.8594,0.0,0.0,0.0,1.0,know else illegal basic economy shit feel like got tricked stop try and rip us,,2
6562,2017-10-27,18:21:07,Richard91154946,"@axhaer @shishnfips @tierschutz_bund This is barbaric cruelty, in the name of god some one in the @united Nations council stop  this cruelty. Those that do nothing are guilty",-0.7627,0.0,0.0,0.0,1.0,barbaric cruey name god one nations council stop cruey nothing guiy,,4
6575,2017-10-27,18:05:33,simon_haye,@EntelechyMan @molly_knight @united Me too. Same height and same expectations of torture,-0.5994,0.0,0.0,0.0,1.0,height expectations torture,,4
6580,2017-10-27,18:01:40,abi_stricklin,"Seriously, @united WHAT KIND OF PLANE IS THIS. Most disgusting flight I've ever been on",-0.659,0.0,0.0,0.0,1.0,seriously kind plane disgusting flight i have ever,,4
6591,2017-10-27,17:46:28,KevFeld,@kalan_beisel @usacycling @DominicSuozzi Holy cow! I wonder if we can notify his sponsors so they know he’s making death threats @SierraNevada @RideShimano @united @giroditalia,-0.7901,0.0,0.0,0.0,1.0,holy cow wonder notify sponsors know he is making death threats,,1
6592,2017-10-27,17:46:26,carlac369,@NancyLeeGrahn @united All you do is complain. I feel so sorry for you @NancyLeeGrahn,-0.4754,0.0,0.0,0.0,1.0,complain feel sorry,,1
6593,2017-10-27,17:46:12,DGCroadguy,@United My biz class ticket does not get me lounge access in ORD? Non planned 4hr layover airline fault too!  Lame! #shouldhaveflowndelta,-0.7256,0.0,0.0,0.0,1.0,biz class ticket get lounge access ord non planned layover airline fau lame #shouldhaveflowndea,['#shouldhaveflowndea'],4
6595,2017-10-27,17:44:22,AliVaez,"@united the most frustrating experience is to land @Dulles_Airport 70 min early with UA951, but they refuse to open the gate for 40mins!",-0.6356,0.0,0.0,0.0,1.0,frustrating experience land min early ua951 refuse open gate,,2
6604,2017-10-27,17:38:24,ZachHonig,@DT_Les @united Is this LAX? For the SIN flight?,-0.6901,0.0,0.0,0.0,1.0,lax sin flight,,1
6609,2017-10-27,17:35:44,barbarakauss,@Duckfanbecks87 @united Losing 1 day may not seem important- but it was 1/2 of the time and now includes a red eye.do frustrated as it took half of the short trip.,-0.7715,0.0,0.0,0.0,1.0,losing day may seem important time includes red eyedo frustrated took half short trip,,1
6610,2017-10-27,17:34:55,arctec34,@Delta Remember me? It's been another week. I don't understand how you can possibly have such awful customer service. I just booked @united,-0.4588,0.0,1.0,0.0,1.0,remember another week do not understand possibly awful customer service booked,,3
6611,2017-10-27,17:34:48,c_dubs87,Yikes...and I thought @united was bad,-0.5423,0.0,0.0,0.0,1.0,yikesand thought bad,,4
6613,2017-10-27,17:31:10,Doolife,@united No I was not I booked my own train back. I also waited an hr and 30 mins for you to get my bags to me from the plane. This is insane,-0.5994,0.0,0.0,0.0,1.0,booked train back also waited hr minutes get bags plane insane,,4
6628,2017-10-27,17:07:23,JuliaAr42306861,@united New Jersey airport is horrible your employee pushed me,-0.5423,0.0,0.0,0.0,1.0,new jersey airport horrible employee pushed,,2
6629,2017-10-27,17:06:08,JuliaAr42306861,@united I only made a twitter to say HOW HORRIBLE YOUR SERVICE IS. HOW YOU STAY IN BUSINESS I HAVE NO IDEA,-0.8001,0.0,0.0,0.0,1.0,made twitter say horrible service stay business idea,,3
6634,2017-10-27,17:02:48,jasonclevine,"@molly_knight @united Do not question the wisdom of United, citizen. The consequences could be dire.",-0.4545,0.0,0.0,0.0,1.0,question wisdom united citizen consequences could dire,,4
6656,2017-10-27,16:43:12,MommyPowers,1) SO upset! @united lost my luggage last nite. I was told it'd be delivered this morning ...,-0.7987,0.0,0.0,0.0,1.0,upset lost luggage last nite told itd delivered morning,,2
6662,2017-10-27,16:39:43,stephenthoma,@JoshFerge @united it's so that they can visually check you're not bringing a carry on. so stupid 🤦‍️,-0.656,0.0,0.0,0.0,1.0,visually check you are bringing carry stupid 🤦️,,2
6672,2017-10-27,16:36:19,D_Beckhoff,@molly_knight @united It's getting worse than Fenway splinter seats..,-0.4767,0.0,0.0,0.0,1.0,getting worse fenway splinter seats,,2
6686,2017-10-27,16:31:44,DonnyOutWest,"@molly_knight @united Sadly, this is in the works :(",-0.6908,0.0,0.0,0.0,1.0,sadly works,,4
6696,2017-10-27,16:28:18,RealHuckShow,"@molly_knight @united and no pesky ""limit"" on alcoholic drinks - where do I donate?",-0.5267,0.0,0.0,0.0,1.0,pesky limit alcoholic drinks donate,,2
6708,2017-10-27,16:25:23,Mosesosbourne,"god how i missed airlines in america, also @united fuck you once again.",-0.5574,0.0,0.0,0.0,1.0,god missed airlines america also fuck,,4
6711,2017-10-27,16:24:43,steveneisenpr12,@molly_knight @united Guess the Skies aren't all that Friendly!,-0.4442,0.0,0.0,0.0,1.0,guess skies are not friendly,,4
6715,2017-10-27,16:23:49,LeonardNotKawhi,"@molly_knight @united Don't tell Dallas Keuchel, he'll tell you to stop complaining",-0.4588,0.0,0.0,0.0,1.0,do not tell dallas keuchel hell tell stop complaining,,2
6718,2017-10-27,16:23:07,danhaefeli,"@molly_knight @united Damn, 1000+ flights? That's almost as hard to believe as how cramped @united's seats are",-0.4256,0.0,0.0,0.0,1.0,damn flights thats almost hard believe cranded seats,,1
6723,2017-10-27,16:22:23,riley_faircloth,"@united, running all over airports because your planes have problems and delays is ridiculous.",-0.6369,0.0,0.0,0.0,1.0,running airports planes problems delays ridiculous,,0
6724,2017-10-27,16:22:21,JohnnyDakar,"@molly_knight @united All American publicly-traded airlines suck. All of them. Fly Alaskan or Southwest or JetBlue when you can, or foreign carriers.",-0.4404,0.0,0.0,0.0,1.0,american publiclytraded airlines suck fly alaskan southwest jetblue foreign carriers,,4
6725,2017-10-27,16:22:03,ToddLytle,@united #BoycottUnitedAirlines now! Unacceptable behavior by #airline. CEO #OscarMunoz should be #fired  &amp; #blacklistedforlife.,-0.5093,0.0,0.0,0.0,1.0,#boycottunitedairlines unacceptable behavior #airline ceo #oscarmunoz #fired and #blacklistedforlife,"['#boycottunitedairlines', '#airline', '#oscarmunoz', '#fired', '#blacklistedforlife']",4
6726,2017-10-27,16:21:49,ssenier,"@united, you're killing me",-0.6597,0.0,0.0,0.0,1.0,you are killing,,2
6735,2017-10-27,16:14:10,CducSJC,It is horrible customer experience. Shame on @United.,-0.765,0.0,0.0,0.0,1.0,horrible customer experience shame,,3
6737,2017-10-27,16:12:56,mommomteri3,@NancyLeeGrahn @united The last several times I flew South I got so sick. #novactionfun4me,-0.6418,0.0,0.0,0.0,1.0,last several times flew south got sick #novactionfun4me,['#novactionfun4me'],2
6742,2017-10-27,16:09:22,BiggestBiscuit,"Suddenly being beaten and dragged off a plane doesn't seem so bad.Hey @united, you up?",-0.4588,0.0,0.0,0.0,1.0,suddenly beaten dragged plane does not seem badhey,,4
6743,2017-10-27,16:09:20,CducSJC,@united #unitedbasiceconomy is so sad. I'm a loyal Mileage Plus member my entire life and this is the treatment? Very disappointed.,-0.615,0.0,0.0,0.0,1.0,#unitedbasiceconomy sad i am loyal mileage plus member entire life treat the momentent disappointed,['#unitedbasiceconomy'],4
6765,2017-10-27,15:43:59,BritBlalock,@united 1 of your agents just helped me get my parents earlier flights to my nephew who's in the hospital &amp; very ill. Can't thank you enough,-0.6669,0.0,0.0,0.0,1.0,agents helped get parents earlier flights nephew who is hospital and i will can not thank enough,,2
6779,2017-10-27,15:27:57,maudrit,"@united 14 hour flight and no entertainment system working?, really?. Unacceptable! UA7.",-0.4682,0.0,0.0,0.0,1.0,hour flight entertainment system working really unacceptable ua7,,0
6780,2017-10-27,15:27:02,louseno,@united worst customer service. Been waiting weeks for a refund that was promised to take 7-10 business days smh,-0.5994,0.0,0.0,0.0,1.0,worst customer service waiting weeks refund promised take business days shaking my head,,3
6785,2017-10-27,15:15:50,jabarnett12,This is getting ridiculous @united. 2 flights 3 mechanical issues. And still waiting to get home to CAK. Scheduled to leave 3 hrs ago.,-0.4019,0.0,0.0,0.0,1.0,getting ridiculous flights mechanical issues still waiting get home cak scheduled leave hours ago,,0
6791,2017-10-27,15:10:22,Robsonk,"Flying @united ONLY bc of free voucher from last time they screwed up. Been on the plane at ORD for an hour, no updates, attendants in chaos",-0.7003,0.0,0.0,0.0,1.0,flying bc free voucher last time screwed plane ord hour updates attendants chaos,,4
6797,2017-10-27,15:04:13,jpry01,Sorry @united but I’m not on board with the no tvs on long haul flights. My phone isn’t gonna cut it. #eastcoastbound,-0.6808,0.0,0.0,0.0,1.0,sorry i am board tvs long haul flights phone is not gonna cut #eastcoastbound,['#eastcoastbound'],0
6799,2017-10-27,15:03:31,fridayjoexmoore,@Farida_N @togo_debout @FEGnassingbe Jesus Christ this is really bad what are the @United Nations doing about all this now faure must go my country Togo is in pain,-0.796,0.0,0.0,0.0,1.0,jesus christ really bad nations faure must go country togo pain,,4
6802,2017-10-27,14:58:19,RLilesChadwick,Every time I fly @united it is a reminder why everyone hates @united,-0.4404,0.0,0.0,0.0,1.0,every time fly reminder everyone hates,,1
6809,2017-10-27,14:50:32,meeshal,@that_alycat @united I'm so tired and ANNOYED,-0.8094,0.0,0.0,0.0,1.0,i am tired annoyed,,0
6815,2017-10-27,14:41:46,0504Traveller,@united rejects @JetBlue concerns re @AirCanada JV,-0.4939,0.0,0.0,0.0,1.0,rejects concerns jv,,4
6817,2017-10-27,14:39:59,wunderlotus,"@united i know it's not YOUR fault, KL, but this policy is not very customer friendly.",-0.4805,0.0,0.0,0.0,1.0,know fau kl policy customer friendly,,3
6827,2017-10-27,14:28:47,JulexisMagic,@NancyLeeGrahn @united I haven't had a good flight experience since the 90s. I was on a basically empty plane &amp; was able to sleep spread over 3 seats.  Memories!,-0.542,0.0,0.0,0.0,1.0,have not good flight experience since basically empty plane and able sleep spread seats memories,,4
6832,2017-10-27,14:24:27,abi_stricklin,It's not even lunch time and @united has already pissed me off,-0.6369,0.0,0.0,0.0,1.0,even lunch time already pissed,,1
6833,2017-10-27,14:22:42,YerboutiSheik,"@bayareahausfrau @united I had no problem at all, Frau. Prolly cuz I flew @AmericanAir.",-0.5994,1.0,0.0,0.0,1.0,problem frau prolly because flew,,2
6849,2017-10-27,14:05:07,revolu_tia,"@united you guys are thieves. You don’t train your employees, they misinform customers, &amp; you’re stealing money. Never flying with ya again",-0.7906,0.0,0.0,0.0,1.0,guys thieves do not train employees misinform customers and you are stealing money never flying ya,,1
6851,2017-10-27,14:04:54,meeshal,Ran from Terminal B to E just to miss my flight to PHX b/c @United booked me on a fight that landed 25 mins before the next one took off.,-0.4939,0.0,0.0,0.0,1.0,ran terminal miss flight phx bc booked fight landed minutes next one took,,0
6853,2017-10-27,14:03:38,SevenDubstepUK,I try to fly @United airlines  as least as possible. Today's fuck ups... Landing in terminal 1 and making the...,-0.5423,0.0,0.0,0.0,1.0,try fly airlines least possible todays fuck ups landing terminal making,,4
6860,2017-10-27,13:55:14,secretgolf_Joel,"So glad @united takes our broken jet and replaces it WITH ANOTHER broken jet!! ORD Sucks, guys are the worst here #NeverChange",-0.8776,0.0,0.0,0.0,1.0,glad takes broken jet replaces another broken jet ord sucks guys worst #neverchange,['#neverchange'],4
6869,2017-10-27,13:41:21,janztweet,"@united sucked - leg space, distance between gates, failure to send wheelchair, husband ""never again""",-0.743,0.0,0.0,0.0,1.0,sucked leg space distance gates failure send wheelchair husband never,,2
6879,2017-10-27,13:23:34,UMDChelseaT,hey @united i flew &amp; had to pay for a bag - didnt get a receipt &amp; need to submit for work. requested one 10+ days ago &amp; still nothing! help?,-0.4497,0.0,0.0,0.0,1.0,hey flew and pay bag did not get receipt and need submit work requested one days ago and still nothing help,,2
6880,2017-10-27,13:22:38,JanetteMarashli,"@NancyLeeGrahn @united Oh ugh.  Fortunately I get violently air, sea and car sick.  Will walk to Canada though.  Feel better. ️",-0.7906,0.0,0.0,0.0,1.0,oh ugh fortunately get violently air sea car sick walk canada though feel better,,1
6888,2017-10-27,13:10:37,Squirl38,@NancyLeeGrahn @united Too bad you can't fly like on #GH. Always first class and you can go half-way around the world during a 5 minute commercial break.,-0.6818,0.0,0.0,0.0,1.0,bad can not fly like #gh always first class go halfway around world minute commercial break,['#gh'],4
6891,2017-10-27,13:07:58,elska_magazine,"@ZachHonig @united Definitely SIN - prices are insane. But if money is no object, EZE is incredible.",-0.7603,0.0,0.0,0.0,1.0,definitely sin prices insane money object eze incredible,,1
6892,2017-10-27,13:07:54,poodlepatty,@NancyLeeGrahn @united The Greyhound of the skies. Treated horribly while they extort you to check a suitcase.,-0.5267,0.0,0.0,0.0,1.0,greyhound skies treated horribly extort check suitcase,,2
6894,2017-10-27,13:05:55,jonminkoff,@united I have lost all respect - this agent will not listen and has treated a customer so bad he must reach out this way on flight UA744,-0.5561,0.0,0.0,0.0,1.0,lost respect agent listen treated customer bad must reach way flight ua744,,4
6899,2017-10-27,13:02:17,jonminkoff,@united this is agent that is making me very uncomfortable treated me with a very hard time and would not let me speak,-0.5553,0.0,0.0,0.0,1.0,agent making uncomfortable treated hard time would let speak,,1
6906,2017-10-27,12:51:08,notnikkogianino,just got screwed by @united why was I stupid enough to book with this dysfunctional company smdh..,-0.765,0.0,0.0,0.0,1.0,got screwed stupid enough book dysfunctional company smdh,,2
6912,2017-10-27,12:40:15,Johnnymc17,"@united I have submitted this twice&amp; sent a formal, postal  letter. All with no response. Call or email me directly. This is getting ridiculous",-0.5719,0.0,0.0,0.0,1.0,submitted twiceand sent formal postal letter response call email directly getting ridiculous,,0
6917,2017-10-27,12:34:41,_JenniiD_,@united a mistake ..... Then i get my ticket with no seat  And i paid extra for it....,-0.5574,0.0,0.0,0.0,1.0,mistake get ticket seat paid extra,,2
6924,2017-10-27,12:24:08,MrsStephens21,@united so disappointed we were told no upgrades only to walk past 6 empty first class seats #honeymoon #firstclassfail,-0.7501,0.0,0.0,0.0,1.0,disappointed told upgrades walk past empty first class seats #honeymoon #firstclassfail,"['#honeymoon', '#firstclassfail']",2
6925,2017-10-27,12:22:47,WayneLink84,@DanaBrookeWWE @united @united screwed me on a flight from Las Vegas. I filed a complaint with the BBB. How do you switch my flights and not notify me?,-0.6597,0.0,0.0,0.0,1.0,screwed flight las vegas filed complaint bbb switch flights notify,,3
6945,2017-10-27,11:47:24,scalacar,@united check your planes beforehand!!! 2 hours delay is unacceptable...especially when you travel for work and have commitments!!!,-0.453,0.0,0.0,0.0,1.0,check planes beforehand hours delay unacceptableespecially travel work commitments,,0
6958,2017-10-27,11:17:35,_JenniiD_,@united I swear i hate flyin with y’all... 🤦‍️ It’s always something,-0.5994,0.0,0.0,0.0,1.0,swear hate flyin you all 🤦️ always something,,4
6971,2017-10-27,10:29:32,Duckfanbecks87,Mad with @flyEUG for a second time in months my flight has been delayed and ruined my trip. Also thanks @United 1/2 my vacation gone. ,-0.6486,0.0,0.0,0.0,1.0,mad second time months flight delayed ruined trip also thanks vacation gone,,1
6974,2017-10-27,10:08:08,Johnnymc17,@united what's the point of having a complaints team that don't respond to complaints. Poor form!,-0.8313,0.0,0.0,0.0,1.0,what is point complaints team do not respond complaints poor form,,1
6978,2017-10-27,09:40:20,HMartin80,"@TheCandiceAdams @united @Delta I’m @united premier, but @delta has an insane CX all around!",-0.5916,0.0,1.0,0.0,1.0,i am premier insane cx around,,2
6980,2017-10-27,09:32:04,sginevan,@united flight 900 - LHR to SFO is the last flight for this 747. Sad to see it go.,-0.4767,0.0,0.0,0.0,1.0,flight 1 hour sfo last flight sad see go,,4
6987,2017-10-27,09:07:31,sansom86,@jemima1984 @united Cheese attack,-0.4767,0.0,0.0,0.0,1.0,cheese attack,,2
6991,2017-10-27,08:26:04,AirAviation1,@united Farewell! :(,-0.4926,0.0,0.0,0.0,1.0,farewell,,4
7000,2017-10-27,07:55:32,Motab909,"@RenHotels You know what would be unexpected, serendipitous, and business unusual? If you changed your goddamn ad on @United airlines.",-0.4767,0.0,0.0,0.0,1.0,know would unexpected serendipitous business unusual changed goddamn ad airlines,,1
7011,2017-10-27,07:15:37,bayareahausfrau,"@united, you are the worst. The absolute worst.",-0.8481,0.0,0.0,0.0,1.0,worst absolute worst,,4
7016,2017-10-27,07:02:48,JoshSussman,@AJELKALLEJERO @united This is awful.,-0.4588,0.0,0.0,0.0,1.0,awful,,1
7027,2017-10-27,06:34:16,TheCandiceAdams,@united @Delta Update: the $10 voucher doesn’t cover a glass of wine to *unwind* from the stress. Boarded at 8:40 so we’re creeping on 3 hours. @united,-0.4215,0.0,1.0,0.0,1.0,update voucher does not cover glass wine unwind stress boarded creeping hours,,0
7038,2017-10-27,05:57:39,TheCandiceAdams,"Are you serious @united? #premier status and you think my time —2 hrs &amp; counting, and patience with your rude staff— is worth $10? #Rad",-0.4137,0.0,0.0,0.0,1.0,serious #premier status think time —2 hours and counting patience rude staff— worth #rad,"['#premier', '#rad']",1
7044,2017-10-27,05:39:45,TheCandiceAdams,"Craptastic enough to be on a red-eye from LAX to EWR, but an 1:40 (and counting) mechanical delay is just cruel. cc: @united #thanksunited",-0.8462,0.0,0.0,0.0,1.0,craptastic enough redeye lax ewr counting mechanical delay cruel credit card #thanksunited,['#thanksunited'],0
7047,2017-10-27,05:24:28,Maaasters,@united is easily the worst airline I've ever flown with.,-0.4019,0.0,0.0,0.0,1.0,easily worst airline i have ever flown,,4
7051,2017-10-27,05:01:34,Posbourn79,"@Expedia, why would you sell @united basic economy tickets without a clear warning about how horrible basic economy is? #UnitedSucks",-0.5644,0.0,0.0,0.0,1.0,would sell basic economy tickets without clear warning horrible basic economy #unitedsucks,['#unitedsucks'],2
7055,2017-10-27,04:56:30,jeanwyen,Warning: choosing the “auto check in 4 ut rtn flight option” when cking in 2 @united flight = placed into middle seat no seat selec avail!,-0.5983,0.0,0.0,0.0,1.0,warning choosing auto check ut rtn flight option cking flight placed middle seat seat selec avail,,2
7064,2017-10-27,04:39:48,CSR_MplsSea,@united @astros Can’t wait for their viral story about being stranded and only getting food vouchers for their trouble,-0.4019,0.0,0.0,0.0,1.0,can not wait viral story stranded getting food vouchers trouble,,0
7072,2017-10-27,04:27:45,smbartle,@uncheels29 @united Fix Sean’s 9 hour flight hell u know u can what are u waiting for?,-0.6808,0.0,0.0,0.0,1.0,fix seans hour flight hell know waiting,,0
7073,2017-10-27,04:26:37,alepsis,The not so friendly skies @united,-0.5116,0.0,0.0,0.0,1.0,friendly skies,,4
7080,2017-10-27,04:23:08,uncheels29,"@smbartle @united I got nothing. United didn’t even ask me the flight number I was on. They have no idea what happened, complete BS",-0.4993,0.0,0.0,0.0,1.0,got nothing united did not even ask flight number idea happened complete bs,,2
7089,2017-10-27,04:10:39,mrshred,@united #510 90 mins late no movies no wifi no power ports +hour+ to get bags #unitedairlines #unfriendlyskies,-0.6808,0.0,0.0,0.0,1.0,#510 minutes late movies wifi power ports hour get bags #unitedairlines #unfriendlyskies,"['#510', '#unitedairlines', '#unfriendlyskies']",0
7097,2017-10-27,03:45:44,wunderlotus,"first of all, @united why do your miles expire? unfair.",-0.4767,0.0,0.0,0.0,1.0,first miles expire unfair,,2
7100,2017-10-27,03:42:28,mikepboyle,@TaaaaylorJ @united Horrible customer service!,-0.5848,0.0,0.0,0.0,1.0,horrible customer service,,3
7117,2017-10-27,03:15:18,TavolaMed,WARNING TO PET-LOVERS! Don't fly @United Express with your small dogs.,-0.5307,0.0,0.0,0.0,1.0,warning petlovers do not fly express small dogs,,2
7118,2017-10-27,03:15:12,Dawson_Pepin,@united Oh no!!! Why will there be no more 747’s that are operated by you guys?,-0.6458,0.0,0.0,0.0,1.0,oh operated guys,,1
7137,2017-10-27,02:43:39,TeriMasonPhoto,@united 1234. And we apparently checked in wrong ?!? So lost our seats and are now on row 39. Not pleased. At all.,-0.5338,0.0,0.0,0.0,1.0,apparently checked wrong lost seats row pleased,,2
7144,2017-10-27,02:34:54,charles_coop,@bkav34 @united Could be worse,-0.4767,0.0,0.0,0.0,1.0,could worse,,1
7146,2017-10-27,02:32:25,ginnyxo,My flight has been delayed and delayed all day long. Now the plane is broken? What is happening?! @united,-0.7616,0.0,0.0,0.0,1.0,flight delayed delayed day long plane broken happening,,0
7147,2017-10-27,02:31:22,john_castro805,Sad to see her go  ️ “#UA747Farewell ” by @united,-0.4767,0.0,0.0,0.0,1.0,sad see go #ua747farewell,['#ua747farewell'],4
7148,2017-10-27,02:31:13,adriandomanico,"@united Basic Economy is brutal, can’t get my boarding pass. Won’t be booking that fare again. Wont even let me pay for an upgrade out of it",-0.6705,0.0,0.0,0.0,1.0,basic economy brutal can not get boarding pass will not booking fare will not even let pay upgrade,,2
7150,2017-10-27,02:30:03,kbconner,"@kevinhoneycutt @united Brutal! That’s a gut punch, having your ace broken",-0.8172,0.0,0.0,0.0,1.0,brutal thats gut punch ace broken,,1
7152,2017-10-27,02:23:56,JuJuMs96,@lucasmisera @united Carry-ons? No way!Complimentary snacks? Nope!Delayed flights? Always!,-0.5597,0.0,0.0,0.0,1.0,carryons waycomplimentary snacks nopedelayed flights always,,0
7156,2017-10-27,02:17:36,SerchRC,"It is wild how @united gouges you.They made you pay for fuckin TV, for a goddamn movie.Wild.",-0.5423,0.0,0.0,0.0,1.0,wild gouges youthey made pay fuckin tv goddamn moviewild,,2
7157,2017-10-27,02:17:00,ilmoti,@united 14 hrs flight without entertainment multimedia!! what a deal with @united . bullshit! no one answer me. #scamunited,-0.8484,0.0,0.0,0.0,1.0,hours flight without entertainment muimedia deal bullshit one answer #scamunited,['#scamunited'],0
7168,2017-10-27,02:03:52,TobyBaratta,Hey @united how are you literally the worst airline ever,-0.6249,0.0,0.0,0.0,1.0,hey literally worst airline ever,,4
7171,2017-10-27,01:59:58,danpodsedly,"Death, taxes, and completely full @united flights.",-0.5994,0.0,0.0,0.0,1.0,death taxes completely full flights,,0
7172,2017-10-27,01:59:22,ShaneAllison,@DanaBrookeWWE @united That’s ridiculous oh hell naw,-0.7964,0.0,0.0,0.0,1.0,thats ridiculous oh hell naw,,1
7173,2017-10-27,01:58:55,gasinger57,"@cindyknoxville @groversgirl1 @united Libs are ridiculous sober, funny as hell when drunk!",-0.784,0.0,0.0,0.0,1.0,libs ridiculous sober funny hell drunk,,1
