,Date,time,handle,tweet,compound,American,Delta,Southwest,United,tweets_clean1,hashtags,cluster_num
9212,2017-10-25,04:18:36,flytyingguy,@rrhoover @united They so suck! I am sorry you had to fly with them at such a sad time,-0.827,0.0,0.0,0.0,1.0,suck sorry fly sad time,,1
9222,2017-10-25,03:55:36,Bob55778770,@KTLA Fuck you @united    What a bunch af bullshit!,-0.8221,0.0,0.0,0.0,1.0,fuck bunch af bullshit,,4
9227,2017-10-25,03:41:03,LourdesAnnette,@united has the worst customer service ever rude attendants wasting my money neglecting a minor passenger. #fuckunited,-0.91,0.0,0.0,0.0,1.0,worst customer service ever rude attendants wasting money neglecting minor passenger #fuckunited,['#fuckunited'],3
11592,2017-11-02,16:24:19,dubephnx,Breaking! @Delta @AmericanAir @UnitedAirways stocks plummet due to Manafort &amp; Gates losing passports! @MSNBC @CNN @USATODAY @azcentral @ABC,-0.4912,1.0,1.0,0.0,1.0,breaking stocks plummet due manafort and gates losing passports,,2
22859,2017-11-04,04:05:33,I8Pink2,@GilWritesHere @Super_awwsum @SouthwestAir @united Coach is still coach and even FC domestic not a huge improvement.,-0.5334,0.0,0.0,1.0,1.0,coach still coach even fc domestic huge improvement,,2
32241,2017-10-26,07:24:14,scotchoverflow,@LPLive I SO SO SO BADLY WANT TO GO TO THIS WHY ARE NYC TO LA TICKETS SO EXPENSIVE @JetBlue @UnitedAirHelp @SouthwestAir,-0.5894,0.0,0.0,1.0,1.0,badly want go nyc la tickets expensive,,1
34413,2017-11-03,13:26:02,tangofoxtees,@photoJDL @UnitedFlyerHD @AmericanAir Mad Dogs make pilots,-0.4939,1.0,0.0,0.0,1.0,mad dogs make pilots,,0
47832,2017-11-05,22:40:08,amin_utsav,"What a horrible @united airline. After waiting one hour on the runway , they are taking the flight back to the gate flight # 2384",-0.5423,0.0,0.0,0.0,1.0,horrible airline waiting one hour runway taking flight back gate flight,,4
47833,2017-11-05,22:39:05,Lina_Golightly,The rudest checkin person at @united ticket counter at DFW airport ever #thisiswhyiflyaa #neveragain,-0.5423,0.0,0.0,0.0,1.0,rudest checkin person ticket counter dfw airport ever #thisiswhyiflyaa #neveragain,"['#thisiswhyiflyaa', '#neveragain']",2
47843,2017-11-05,22:28:48,LordofAscension,How is it possible that every year my trip home from #BlizzCon is a disaster of epic proportions? This is the last time I will fly @united,-0.6249,0.0,0.0,0.0,1.0,possible every year trip home #blizzcon disaster epic proportions last time fly,['#blizzcon'],1
47846,2017-11-05,22:25:24,mikeramirez28,Just had the rudest gate agent in LAX by @united absolutely unacceptable...will never fly @united again..switching to @Delta,-0.5423,0.0,1.0,0.0,1.0,rudest gate agent lax absolutely unacceptablewill never fly againswitching,,2
47847,2017-11-05,22:24:55,j_herzzy,@united Dont worry I made it to the plane...if only we could get off the tarmac,-0.4404,0.0,0.0,0.0,1.0,do not worry made planeif could get tarmac,,0
47848,2017-11-05,22:24:36,samourairouge,.@united they should change the name of your airline to piece of shit airline,-0.5574,0.0,0.0,0.0,1.0,united change name airline piece shit airline,,4
47854,2017-11-05,22:16:00,kurian_v,@united The whole experience was very stressful and unpleasant. I was the last passenger to board. Barely made it after running from Terminal D to A,-0.788,0.0,0.0,0.0,1.0,whole experience stressful unpleasant last passenger board barely made running terminal,,4
47856,2017-11-05,22:11:19,TheBeast13,"So, with no notification of anything @united airlines cancelled our flight.",-0.539,0.0,0.0,0.0,1.0,notification anything airlines cancelled flight,,1
47858,2017-11-05,22:10:10,dowsk_logic,@united ok to say temp biz lounge does not allow guest. not ok to send us no where for @Lufhansa lounge. Bad service at global lounge sfo ,-0.4526,0.0,0.0,0.0,1.0,ok say temp biz lounge allow guest ok send us lounge bad service global lounge sfo,,4
47866,2017-11-05,21:57:34,RachelK_222,@SJKIKEENAN @united So annoying!! #goodluck,-0.554,0.0,0.0,0.0,1.0,annoying #goodluck,['#goodluck'],2
47873,2017-11-05,21:51:48,simnett,@united and now my wife is stuck waiting for UA4959 today. That's 15 hours of delay between the two of us in 3 days :-(,-0.7003,0.0,0.0,0.0,1.0,wife stuck waiting ua4959 today thats hours delay two us days,,0
47880,2017-11-05,21:44:07,NeilABurns,@united 751 delayed on ground again. No update nothing.,-0.4767,0.0,0.0,0.0,1.0,delayed ground update nothing,,0
47884,2017-11-05,21:40:43,amin_utsav,"@united Rude employees at gate c113 EWR. Even though I explained them that I had fragile item in my carryon bag, they forced me to check in the bag",-0.7184,0.0,0.0,0.0,1.0,rude employees gate c113 ewr even though explained fragile item carry on bag forced check bag,,2
47891,2017-11-05,21:31:25,taliabenamy,"Unsurprisingly, in addition to being physically terrible to its customers, @united is also scammy and deceptive. Stay away.",-0.4767,0.0,0.0,0.0,1.0,unsurprisingly addition physically terrible customers also scammy deceptive stay away,,2
47892,2017-11-05,21:30:49,amin_utsav,@united worst customer service Flight # 2384,-0.6249,0.0,0.0,0.0,1.0,worst customer service flight,,3
47911,2017-11-05,21:05:56,ZachHonig,"@united @MakeAWish #4 went to @casadeesperanza, but I got another 12,500 for 2x broken WiFi. Any suggestions for mileage donation #5?",-0.631,0.0,0.0,0.0,1.0,#4 went got another broken wifi suggestions mileage donation #5,"['#4', '#5']",2
47913,2017-11-05,21:04:58,relyes,"While @united bloodies its passengers in the course of “policy” enforcement, @SouthwestAir manages a still worse experience. #impressive",-0.4767,0.0,0.0,1.0,1.0,bloodies passengers course policy enforcement manages still worse experience #impressive,['#impressive'],2
47915,2017-11-05,21:04:17,SJKIKEENAN,@RachelK_222 @united Ugh. I have to file one too. I dread this.,-0.7003,0.0,0.0,0.0,1.0,ugh file one dread,,0
47947,2017-11-05,20:21:02,Ryan_Cheng,@United changed my reservation to a smaller aircraft and forced me to buy the check bag for my carry-on. Compensation is needed!!! ,-0.5962,0.0,0.0,0.0,1.0,changed reservation smaller aircraft forced buy check bag carry on compensation needed,,2
47957,2017-11-05,20:11:09,lesleygirl,Hey @united you canceled my EWR-GRR flight with no notification &amp; no possible rebook. Unacceptable customer service!,-0.7712,0.0,0.0,0.0,1.0,hey canceled ewrgrr flight notification and possible rebook unacceptable customer service,,3
47958,2017-11-05,20:10:07,tjo4,Some of my most memorable flights took place on the @united 747s. So sad to see them go.,-0.5256,0.0,0.0,0.0,1.0,memorable flights took place sad see go,,4
47974,2017-11-05,20:00:23,abseyeMD,@united @united DM conversation pointless. Accused me of not informing the FA and it's my fault...wow worst customer service!!!,-0.8007,0.0,0.0,0.0,1.0,direct message conversation pointless accused informing fa fauwow worst customer service,,3
47977,2017-11-05,19:56:39,kurian_v,@united delayed flight from CVG to IAD. I will miss the only connection flight today to RIC from IAD!!! I need to get to RIC tonight!!!,-0.5673,0.0,0.0,0.0,1.0,delayed flight cvg iad miss connection flight today ric iad need get ric tonight,,0
47993,2017-11-05,19:43:53,arw11487,Every time I take @united I’m reminded why I should never take United. you guys are seriously the worst,-0.7982,0.0,0.0,0.0,1.0,every time take i am reminded never take united guys seriously worst,,1
48015,2017-11-05,19:28:49,American757PWLA,"@AirlineReporter @BoeingAirplanes @united Northwest was decent, but both ultimately fail because they operated with PW2000's almost exclusively.",-0.6956,0.0,0.0,0.0,1.0,northwest decent uimately fail operated pw2000s almost exclusively,,2
48022,2017-11-05,19:25:11,Blogzworth,Brah @united airlines are the worst thing to happen to human beings since the Black Plague. Never fly with them. ,-0.6249,0.0,0.0,0.0,1.0,brah airlines worst thing happen human beings since black plague never fly,,4
48030,2017-11-05,19:19:23,jalbono,"i’ve managed to watch 4 episodes of the office and packed all my things while be on hold with @united, y’all really suck.",-0.4927,0.0,0.0,0.0,1.0,i have managed watch episodes office packed things hold you all really suck,,4
48035,2017-11-05,19:17:25,Victory205,@AirlineReporter @BoeingAirplanes @united They both sucked. Dingy within a few weeks of application.,-0.4588,0.0,0.0,0.0,1.0,sucked dingy within weeks application,,3
48039,2017-11-05,19:14:26,josephcua,"@united I understand the need to delay to fix a part, but you've changed the departure time more than 4 times which has caused a lot of confusion",-0.5346,0.0,0.0,0.0,1.0,understand need delay fix part you have changed departure time times caused lot confusion,,1
48048,2017-11-05,19:06:37,xty,.@United why are ele travel certificates invisible? Found &gt;$2K expired searching my email. Sad panda :( #travel #miles #CustomerService,-0.7184,0.0,0.0,0.0,1.0,united ele travel certificates invisible found 2k expired searching email sad panda #travel #miles #customerservice,"['#travel', '#miles', '#customerservice']",4
48057,2017-11-05,18:59:11,KellyMRosati,"@united Chaotic. People in groups, confused. No lines. No process clarity. No integration between self check in &amp; counter service.",-0.8126,0.0,0.0,0.0,1.0,chaotic people groups confused lines process clarity integration self check and counter service,,2
48063,2017-11-05,18:53:58,Montalvo501,"@United Worst experience and poor performance, waited 45 minutes prior to exiting plane",-0.802,0.0,0.0,0.0,1.0,worst experience poor performance waited minutes prior exiting plane,,4
48071,2017-11-05,18:49:18,lexy2life,@united Why do y'all suck so much? Huh?,-0.504,0.0,0.0,0.0,1.0,you all suck much huh,,4
48075,2017-11-05,18:45:51,RyanWGates,@united Time wasted not with my kids. I'm so done with @united. Experience with @AmericanAir and @Delta much better. UA is the worst of the worst.,-0.8591,1.0,1.0,0.0,1.0,time wasted kids i am done experience much better ua worst worst,,4
48078,2017-11-05,18:44:09,KellyMRosati,@united total mess at Nashville BNA. Check in a disaster. Please fix it.,-0.6486,0.0,0.0,0.0,1.0,total mess nashville bna check disaster please fix,,2
48082,2017-11-05,18:38:54,RyanWGates,"@united Unfortunately, I find your customer service solutions to be completely unsatisfactory. You guys are all lip service and no action.",-0.4404,0.0,0.0,0.0,1.0,unfortunately find customer service solutions completely unsatisfactory guys lip service action,,3
48084,2017-11-05,18:36:02,RanMan30,@united did you just delay my flight 24hours?  #ua349. This is after being delayed with two toddlers for three hours.,-0.4939,0.0,0.0,0.0,1.0,delay flight #ua349 delayed two toddlers three hours,['#ua349'],0
48096,2017-11-05,18:23:36,yapings,@united @NicholasGarrisn So offer all of them some kind of compensation? What kind of idiotic response is this from #UnitedAirlines customer service?,-0.6432,0.0,0.0,0.0,1.0,offer kind compensation kind idiotic response #unitedairlines customer service,['#unitedairlines'],3
48107,2017-11-05,18:17:47,SFOrob,@AirlineReporter @BoeingAirplanes @united NW. United's 'Worldwide Service' livery is their 2nd worst with the worst being the current one.,-0.8481,0.0,0.0,0.0,1.0,nw uniteds worldwide service livery worst worst current one,,4
48108,2017-11-05,18:16:46,JollyDeanGiant,@united don’t tell customer they were late when the plane left early. Deceit to customers will come back around. Did you not learn?,-0.4588,0.0,0.0,0.0,1.0,do not tell customer late plane left early deceit customers come back around learn,,3
48110,2017-11-05,18:15:34,FreyFri44,"@BlackGryph0n @JHaller_ @united On a  trip to MI, the plane had an engine problem (before we took off) and since it was a smaller plane it was a weight distribution issue.",-0.4019,0.0,0.0,0.0,1.0,trip mi plane engine problem took since smaller plane weight distribution issue,,4
48113,2017-11-05,18:13:39,frankeisele,@united Can’t make this shit up!  Refuel guy is leaving now captain says we need to refuel.  Well what have we been doing for the past 30 min??,-0.5862,0.0,0.0,0.0,1.0,can not make shit refuel guy leaving captain says need refuel well past min,,1
48117,2017-11-05,18:11:12,frankeisele,@united So added fuel and the captain tried to chase down refuel guy .. words exchanged - wonder what’s wrong now.  #unitedsucks,-0.4767,0.0,0.0,0.0,1.0,added fuel captain tried chase refuel guy words exchanged wonder what is wrong #unitedsucks,['#unitedsucks'],2
48127,2017-11-05,18:03:06,HaydenKristal,@united cancelled our flight and forgot to tell the passengers. Garbage people and a garbage airline. Cancelling my account.,-0.4215,0.0,0.0,0.0,1.0,cancelled flight forgot tell passengers garbage people garbage airline cancelling account,,4
48135,2017-11-05,17:54:37,keelandonovan,It’s unreal how bad @united actually is. Terrible customer service,-0.765,0.0,0.0,0.0,1.0,unreal bad actually terrible customer service,,3
48141,2017-11-05,17:48:00,mkrigsman,The terrible @united needs to learn this lesson. I switched to @JetBlue.,-0.4767,0.0,0.0,0.0,1.0,terrible needs learn lesson switched,,4
48146,2017-11-05,17:45:14,frankeisele,@united Nope!  Back to the gate and once again u guys suck!!! #unitedsucks,-0.6209,0.0,0.0,0.0,1.0,nope back gate guys suck #unitedsucks,['#unitedsucks'],4
48149,2017-11-05,17:42:28,jwbvt,@United not having luck leaving btv for ewr. Tix for the 2:29 train to philly. Will they hold train? Is there another 1?,-0.4291,0.0,0.0,0.0,1.0,luck leaving btv ewr tix train philly hold train another,,0
48150,2017-11-05,17:38:41,HassellChance,@united has been the worst air line I have ever flown with after today,-0.6249,0.0,0.0,0.0,1.0,worst air line ever flown today,,4
48154,2017-11-05,17:37:19,EricaKacprowicz,@united Also you are charging us to use WiFi which is so rude as the seeing you are making us wait here longer by canceling the flight,-0.5949,0.0,0.0,0.0,1.0,also charging us use wifi rude seeing making us wait longer canceling flight,,2
48162,2017-11-05,17:27:13,EricaKacprowicz,WORST AIRLINE EVER LITERALLY NEVER TAKE @united !!!!!!!!!!,-0.7906,0.0,0.0,0.0,1.0,worst airline ever literally never take,,4
48167,2017-11-05,17:21:18,RyanWGates,"Oh @united, you're terrible. Flew @AmericanAir to LA with no problems. Flying home with UA? Delayed oversold flight and will not get home.",-0.836,1.0,0.0,0.0,1.0,oh you are terrible flew la problems flying home ua delayed oversold flight get home,,0
48169,2017-11-05,17:17:55,kb_anderson_,@united &amp; terrible CS. asked for a different airline &amp; told all were booked. Now saying it would cost United too much $ to rebook SERIOUSLY?,-0.4084,0.0,0.0,0.0,1.0,and terrible cs asked different airline and told booked saying would cost united much rebook seriously,,4
48170,2017-11-05,17:15:30,JoieDeMoi,@United Only a few minutes in and flight #1175 is disappointing. Your flight attendants desperately need better customer service training.,-0.4404,0.0,0.0,0.0,1.0,minutes flight #1175 disappointing flight attendants desperately need better customer service training,['#1175'],3
48184,2017-11-05,16:50:26,kb_anderson_,@united UNACCEPTABLE. stuck on bus at EWR for “security breech” then arrived at connecting gate EARLY to find plane took off early,-0.694,0.0,0.0,0.0,1.0,unacceptable stuck bus ewr security breech arrived connecting gate early find plane took early,,0
48186,2017-11-05,16:45:31,KMindeguia,"@united planes are garbage... Old and dirty, erk. If it wasn't for my #StarAlliance points, would totally fly another airline in the US.",-0.4404,0.0,0.0,0.0,1.0,planes garbage old dirty erk was not #staralliance points would totally fly another airline us,['#staralliance'],4
48188,2017-11-05,16:39:30,PeckHaylee,@united fuck your airlines,-0.5423,0.0,0.0,0.0,1.0,fuck airlines,,4
48189,2017-11-05,16:38:41,tedfrank,"@united @TSA MSY Pre line is completely unreasonable and unacceptable. You know flights are full Sunday, why understaffed?",-0.5046,0.0,0.0,0.0,1.0,msy pre line completely unreasonable unacceptable know flights full sunday understaffed,,2
48192,2017-11-05,16:35:01,so_toole,@united You're csa went to chk with Supv 1:40:00 ago about a refund of an erroneous seat charge for a Premier customer.  Service level??,-0.4871,0.0,0.0,0.0,1.0,you are csa went chk supv ago refund erroneous seat charge premier customer service level,,3
48197,2017-11-05,16:33:02,JGMELTS,@united Its been days! Im abroad in another country and i cant buy food. You constantly fucked up and im beyond pissed off.,-0.8718,0.0,0.0,0.0,1.0,days i am abroad another country can not buy food constantly fucked i am beyond pissed,,2
48203,2017-11-05,16:26:04,ColtFoutz,@united utter incompetence at FSD as employees somehow forgot to load bags for den flight.  45 min delay and counting.,-0.6808,0.0,0.0,0.0,1.0,utter incompetence fsd employees somehow forgot load bags den flight min delay counting,,0
48207,2017-11-05,16:14:34,CAfromCA,@united Speak of the devil. The app just updated to 5:30. So which is it? 3:30? 5:30? 6? What guarantees do we have this part WORKS? Send a plane.,-0.7476,0.0,0.0,0.0,1.0,speak devil app updated guarantees part works send plane,,4
48210,2017-11-05,16:10:37,jerrylopezdotio,@united @que And on top of that shit I had to pay double the price just now at LaGuardia,-0.4939,0.0,0.0,0.0,1.0,top shit pay double price laguardia,,1
48211,2017-11-05,16:09:51,jerrylopezdotio,@united @que Seriously @united!?!?!? Your rep sells me a flight and gives me a confirmation #. I get to the airport and my reservation can't be found...,-0.4795,0.0,0.0,0.0,1.0,seriously representative sells flight gives confirmation get airport reservation can not found,,2
48220,2017-11-05,15:57:55,Caesar593,"@ChristineChapa @FormAssembly @JessBurkeSFDC @denys_braga Thanks! For future reference, I’d recommend avoiding @united. This flight delay has been a disaster.",-0.5707,0.0,0.0,0.0,1.0,thanks future reference i would recommend avoiding flight delay disaster,,0
48242,2017-11-05,15:25:32,ginaalaurenn,When @united sends a warning email 48 hours before your flight so you cut your vacation short and it doesn’t even get delayed. #furious,-0.6887,0.0,0.0,0.0,1.0,sends warning email hours flight cut vacation short does not even get delayed #furious,['#furious'],0
48246,2017-11-05,15:23:12,adam_shappy,@HilzFuld @united @united has to be the worst airline ever flown. Always issues...,-0.6249,0.0,0.0,0.0,1.0,worst airline ever flown always issues,,4
48247,2017-11-05,15:23:05,suzanneroig,Three delays. Tired and frustrated @united. #stuckinatlanta.,-0.743,0.0,0.0,0.0,1.0,three delays tired frustrated #stuckinatlanta,['#stuckinatlanta'],1
48250,2017-11-05,15:18:35,SocialConnectt,@united you suck. No food or flight vouchers for a 10 hour delay.,-0.7506,0.0,0.0,0.0,1.0,suck food flight vouchers hour delay,,0
48257,2017-11-05,15:07:33,brycerobertson,Very sad the @Delta shuttle is moving to Term C. Left apt at 934 and already at gate. Won’t happen in December. Guess @United at EWR now?,-0.5256,0.0,1.0,0.0,1.0,sad shuttle moving term left apt already gate will not happen december guess ewr,,4
48258,2017-11-05,15:06:58,whoschandler,Yo @united “provides support” my ass! 12 hour delay? @JetBlue would have had another plane within 30 min! ,-0.7494,0.0,0.0,0.0,1.0,yo provides support ass hour delay would another plane within min,,0
48267,2017-11-05,14:59:37,oricysewski,@united Flight attendants announce 35 min delay then 10 min delay and turns out it’s a full hour delay?!?,-0.7616,0.0,0.0,0.0,1.0,flight attendants announce min delay min delay turns full hour delay,,0
48268,2017-11-05,14:59:13,SocialConnectt,Really @united you delayed my flight from 6 am to 6 pm. This is horrible. This is extra money I’m having to spend due to your mistake.,-0.7943,0.0,0.0,0.0,1.0,really delayed flight pm horrible extra money i am spend due mistake,,0
48285,2017-11-05,14:48:57,rolandsmartin,Hate it when you Change your bulkhead seat on @United app and you get to airport and it never changed. On a 5-hour flight. Ugh!,-0.7777,0.0,0.0,0.0,1.0,hate change bulkhead seat app get airport never changed flight ugh,,2
48290,2017-11-05,14:40:22,NicholasGarrisn,@united Very very unhappy. That is a 5 hour delay,-0.688,0.0,0.0,0.0,1.0,unhappy hour delay,,0
48293,2017-11-05,14:35:37,CausticPatriot,@united what’s wrong with this pic???Hint: boarding time was at 8am,-0.5632,0.0,0.0,0.0,1.0,what is wrong pichint boarding time,,1
48294,2017-11-05,14:34:30,Cnorcia78,@NicholasGarrisn @united @united - on this flight too. Totally unacceptable,-0.5095,0.0,0.0,0.0,1.0,flight totally unacceptable,,0
48299,2017-11-05,14:32:36,Cnorcia78,@united - really going to stick us on #ua1900 with a 5+ hour delay? Can’t get another plane here to cut the delay down? #unitedfails,-0.7236,0.0,0.0,0.0,1.0,really going stick us #ua1900 hour delay can not get another plane cut delay #unitedfails,"['#ua1900', '#unitedfails']",0
48302,2017-11-05,14:31:05,NicholasGarrisn,@united Very unhappy,-0.4754,0.0,0.0,0.0,1.0,unhappy,,0
48306,2017-11-05,14:25:33,NicholasGarrisn,Been in Flight delay to San Francisco from Atlanta not sure I will fly #United again @united been sitting for over 2.5 hours,-0.5043,0.0,0.0,0.0,1.0,flight delay san francisco atlanta sure fly #united sitting hours,['#united'],0
48311,2017-11-05,14:21:11,BJenerik,"@RyanEGraney @united Been a while since I flew, but don't they still request that during the critical take off and landing as precaution against interference?",-0.4497,0.0,0.0,0.0,1.0,since flew do not still request critical take landing precaution interference,,2
48324,2017-11-05,14:07:03,VinCent__C,Now @united we’re on the plane delayed and they’re doing maintenance. Annoyed to the max,-0.5423,0.0,0.0,0.0,1.0,plane delayed they are maintenance annoyed max,,0
48326,2017-11-05,14:01:53,SocialConnectt,Then we were not even given any notifications about our flight. Still haven’t. Very unprofessional @united,-0.5563,0.0,0.0,0.0,1.0,even given notifications flight still have not unprofessional,,4
48330,2017-11-05,13:56:52,CAfromCA,Now facing a FIVE HOUR maintenance delay on @united flight 1900. At what point to they stop kidding themselves and send a different plane?,-0.4767,0.0,0.0,0.0,1.0,facing five hour maintenance delay flight point stop kidding send different plane,,0
48336,2017-11-05,13:47:37,RyanEGraney,@united I'm on the plane with a rude ass flight attendant who is behaving like my father making me show him my phone screen.,-0.6124,0.0,0.0,0.0,1.0,i am plane rude ass flight attendant behaving like father making show phone screen,,2
48337,2017-11-05,13:46:41,RyanEGraney,The @united flight attendant just made me show him my phone was in airplane mode. WTF kind of shit is this? I TURNED IT OFF TO TWEET THIS.,-0.8455,0.0,0.0,0.0,1.0,flight attendant made show phone airplane mode wtf kind shit turned tweet,,1
48342,2017-11-05,13:36:11,inbodyd,"@united Tks 4 convenient flt btwn IAD and AUS,  but ur A320 has lousy seat width. Can't sit up straight w someone in middle seat.",-0.775,0.0,0.0,0.0,1.0,tks convenient f btwn iad aus your a320 lousy seat width can not sit straight someone middle seat,,2
48346,2017-11-05,13:25:54,whoschandler,NO MORE FLYING @united this is the THIRD flight in a ROW that has been delayed because of a mechanical issue. FIX YOUR PLANES!,-0.628,0.0,0.0,0.0,1.0,flying third flight row delayed mechanical issue fix planes,,0
48350,2017-11-05,13:22:12,wellyd23,@united We arrived in EWR and missed our connection by 5 minutes. Because there was a 4 hour 20 minutes delay on our initial flight.,-0.5423,0.0,0.0,0.0,1.0,arrived ewr missed connection minutes hour minutes delay initial flight,,0
48358,2017-11-05,13:01:25,RyanEGraney,LOLZ. The @united employees at @EWRairport are so rude today. No one gives a shit.,-0.6702,0.0,0.0,0.0,1.0,lolz employees rude today one gives shit,,1
48359,2017-11-05,13:01:16,alidrums,"@united I am very disappointed with my experience November 4, 2017 flight UA6043 Unacceptable! Missed work ",-0.8353,0.0,0.0,0.0,1.0,disappointed experience november flight ua6043 unacceptable missed work,,2
48362,2017-11-05,12:52:51,jegoodale,"@united Really, 25 minutes before boarding and a pilot gets sick and we're delayed until 11 something?",-0.6369,0.0,0.0,0.0,1.0,really minutes boarding pilot gets sick delayed something,,0
48366,2017-11-05,12:46:59,LTCPeterLerner,"@mikejgr @HilzFuld @united Nice. However, this isn't an upgrade, but customer service 101. He paid to sit with wife &amp; son, paid for wifi - they failed to deliver.",-0.5499,0.0,0.0,0.0,1.0,nice however is not upgrade customer service paid sit wife and son paid wifi failed deliver,,3
48372,2017-11-05,12:39:16,africatechie,@HilzFuld @united I hate @United. Have never had a good flight with them. Always something. Rather connect and fly another airline.,-0.7274,0.0,0.0,0.0,1.0,hate never good flight always something rather connect fly another airline,,4
48375,2017-11-05,12:32:19,melissaeweiss,@HilzFuld @united I know. Every time I want to complain on a plane I think about that video and reconsider. But also @united is terrible.,-0.6486,0.0,0.0,0.0,1.0,know every time want complain plane think video reconsider also terrible,,1
48379,2017-11-05,12:26:37,jagolinzer,@robschuette @united Been burned over and over again by @United commuter jets. Terrible reliability overall. Company should revoke the brand from the carriers,-0.4767,0.0,0.0,0.0,1.0,burned commuter jets terrible reliability overall company revoke brand carriers,,4
48398,2017-11-05,11:53:04,jagolinzer,At some point I will learn to not trust @United commuter flights to connect on time. ,-0.4023,0.0,0.0,0.0,1.0,point learn trust commuter flights connect time,,1
48407,2017-11-05,11:10:12,scott6067,"Coffee stop before the train stop! (at @United Club in Chicago, IL)",-0.5707,0.0,0.0,0.0,1.0,coffee stop train stop club chicago il,,0
